{
  "$schema": "https://json-schema.org/draft/2020-12/schema",
  "$id": "https://local.fanuc-ai-tp/schemas/program-spec.schema.json",
  "title": "FANUC AI TP Program Spec",
  "type": "object",
  "additionalProperties": false,
  "required": ["programName", "intent", "safety", "operations"],
  "properties": {
    "programName": {
      "type": "string",
      "pattern": "^(?:A_[A-Z0-9_]{1,30}|AI_[A-Z0-9_]{1,29})$"
    },
    "intent": {
      "type": "string",
      "minLength": 1
    },
    "controller": {
      "type": "object",
      "additionalProperties": false,
      "properties": {
        "model": { "type": "string" },
        "robotIp": { "type": "string" },
        "winOlpcVersion": { "type": "string" }
      }
    },
    "safety": {
      "type": "object",
      "additionalProperties": false,
      "required": ["motionAllowed", "requiresHumanReview"],
      "properties": {
        "motionAllowed": { "type": "boolean" },
        "requiresHumanReview": { "type": "boolean" },
        "notes": { "type": "string" }
      }
    },
    "assumptions": {
      "type": "object",
      "additionalProperties": true
    },
    "operations": {
      "type": "array",
      "minItems": 1,
      "items": {
        "type": "object",
        "additionalProperties": false,
        "required": ["type"],
        "properties": {
          "type": {
            "type": "string",
              "enum": ["message", "registerWrite", "ioWrite", "wait", "comment", "remark", "diagnosticCheck", "callProgram", "runProgram", "userAlarm", "label", "jump", "ifRegisterEqualsJump"]
          },
          "text": { "type": "string" },
          "remark": { "type": "string" },
          "name": { "type": "string" },
          "program": {
            "type": "string",
            "pattern": "^[A-Z][A-Z0-9_]{0,31}$"
          },
          "arguments": {
            "type": "array",
            "items": {
              "type": "object",
              "additionalProperties": false,
              "required": ["type", "value"],
              "properties": {
                "type": {
                  "type": "string",
                  "enum": ["string", "integer"]
                },
                "value": {
                  "oneOf": [
                    {
                      "type": "string",
                      "pattern": "^[A-Z0-9_ -]{1,32}$"
                    },
                    {
                      "type": "integer"
                    }
                  ]
                }
              }
            }
          },
          "register": { "type": "integer", "minimum": 1 },
          "value": { "type": "integer" },
          "label": { "type": "integer", "minimum": 1, "maximum": 9999 },
          "alarm": { "type": "integer", "minimum": 1, "maximum": 999 },
          "signal": { "type": "string" },
          "state": { "type": "boolean" },
          "seconds": { "type": "number", "minimum": 0 }
        }
      }
    },
    "verification": {
      "type": "object",
      "additionalProperties": false,
      "properties": {
        "roboguideRequired": { "type": "boolean" },
        "operatorRunDecisionOwned": { "type": "boolean" },
        "notes": { "type": "string" }
      }
    }
  }
}
