{
  "programName": "AI_SNAPSHOT",
  "intent": "No-motion operator-guided snapshot review for basic robot state before future generated work.",
  "safety": {
    "motionAllowed": false,
    "requiresHumanReview": true,
    "notes": "No motion. No IO writes. Writes one marker register and displays state for manual review."
  },
  "operations": [
    {
      "type": "message",
      "text": "AI SNAPSHOT"
    },
    {
      "type": "registerWrite",
      "register": 98,
      "value": 20260512
    },
    {
      "type": "diagnosticCheck",
      "name": "MODE",
      "text": "Operator run decision"
    },
    {
      "type": "diagnosticCheck",
      "name": "OVERRIDE",
      "text": "Verify low override"
    },
    {
      "type": "diagnosticCheck",
      "name": "UFRAME",
      "text": "Verify intended frame"
    },
    {
      "type": "diagnosticCheck",
      "name": "UTOOL",
      "text": "Verify intended tool"
    },
    {
      "type": "diagnosticCheck",
      "name": "IO",
      "text": "Verify key IO state"
    }
  ],
  "verification": {
    "roboguideRequired": false,
    "operatorRunDecisionOwned": true,
    "notes": "Verify message, R[98] marker, review comment visibility, and no motion."
  }
}
